{"$schema":"https://json-schema.org/draft/2020-12/schema","type":"object","additionalProperties":false,"required":["as_of","parameters","data_contract","dataset_refs","records"],"properties":{"as_of":{"type":"string","format":"date"},"parameters":{"type":"object","additionalProperties":false,"required":["left_portfolio_id","right_portfolio_id"],"properties":{"left_portfolio_id":{"type":"string","minLength":1,"maxLength":4096},"right_portfolio_id":{"type":"string","minLength":1,"maxLength":4096}}},"data_contract":{"type":"object","additionalProperties":false,"required":["provider","mapping_id","mapping_version","units","date_semantics","adjustment"],"properties":{"provider":{"enum":["synthetic","user_input"]},"mapping_id":{"const":"portfolio-overlap"},"mapping_version":{"const":"1.0.0"},"units":{"type":"object","additionalProperties":false,"required":["weight","overlap"],"properties":{"weight":{"const":"record_declared_decimal_or_percent"},"overlap":{"const":"decimal"}}},"date_semantics":{"const":"holding_disclosure_date"},"adjustment":{"const":"not_applicable"}}},"dataset_refs":{"$ref":"#/$defs/dataset_refs"},"source_hashes":{"$ref":"#/$defs/source_hashes"},"records":{"type":"array","minItems":1,"maxItems":2000,"items":{"type":"object","additionalProperties":false,"required":["portfolio_id","asset_id","weight","weight_unit","as_of"],"properties":{"portfolio_id":{"type":"string","minLength":1,"maxLength":4096},"asset_id":{"type":"string","minLength":1,"maxLength":4096},"weight":{"type":"number","exclusiveMinimum":0},"weight_unit":{"enum":["decimal","percent"]},"as_of":{"type":"string","format":"date"}}}}},"$defs":{"dataset_refs":{"type":"array","minItems":1,"maxItems":32,"items":{"type":"object","additionalProperties":false,"required":["dataset_id","provider_id","as_of","sha256"],"properties":{"dataset_id":{"type":"string","minLength":1,"maxLength":4096},"provider_id":{"enum":["synthetic","user_input"]},"as_of":{"type":"string","format":"date"},"sha256":{"type":"string","pattern":"^[0-9a-fA-F]{64}$"}}}},"source_hashes":{"type":"object","maxProperties":32,"propertyNames":{"type":"string","minLength":1,"pattern":"^(?!.*[\\r\\n\\u2028\\u2029])\\S(?:.*\\S)?$"},"additionalProperties":{"type":"string","pattern":"^[0-9a-fA-F]{64}$"}}}}
