{"as_of":"2026-09-15","parameters":{"left_portfolio_id":"PORT-A","right_portfolio_id":"PORT-B"},"data_contract":{"provider":"synthetic","mapping_id":"portfolio-overlap","mapping_version":"1.0.0","units":{"weight":"record_declared_decimal_or_percent","overlap":"decimal"},"date_semantics":"holding_disclosure_date","adjustment":"not_applicable"},"dataset_refs":[{"dataset_id":"fixture-portfolio-overlap","provider_id":"synthetic","as_of":"2026-09-15","sha256":"3333333333333333333333333333333333333333333333333333333333333333"}],"source_hashes":{"synthetic":"aaaaaaaaaaaaaaaaaaaaaaaaaaaaaaaaaaaaaaaaaaaaaaaaaaaaaaaaaaaaaaaa"},"records":[{"portfolio_id":"PORT-A","asset_id":"STOCK-X","weight":10,"weight_unit":"percent","as_of":"2026-09-15"},{"portfolio_id":"PORT-A","asset_id":"STOCK-X","weight":30,"weight_unit":"percent","as_of":"2026-09-15"},{"portfolio_id":"PORT-A","asset_id":"STOCK-Y","weight":60,"weight_unit":"percent","as_of":"2026-09-15"},{"portfolio_id":"PORT-B","asset_id":"STOCK-X","weight":0.25,"weight_unit":"decimal","as_of":"2026-09-15"},{"portfolio_id":"PORT-B","asset_id":"STOCK-Y","weight":25,"weight_unit":"percent","as_of":"2026-09-15"},{"portfolio_id":"PORT-B","asset_id":"STOCK-Z","weight":50,"weight_unit":"percent","as_of":"2026-09-15"}]}
